{
  "reviewer": "database-reviewer",
  "comparison_fingerprint": "aaaaaaaaaaaaaaaaaaaaaaaaaaaaaaaaaaaaaaaaaaaaaaaaaaaaaaaaaaaaaaaa",
  "status": "approved",
  "findings": [
    "Baseline and candidate use the same query identity, engine, and dataset profile.",
    "Original plans were inspected and the normalized operator delta is accurate."
  ],
  "approved_exception": false,
  "exception_reason": ""
}
